{
  "$schema": "https://json-schema.org/draft/2020-12/schema",
  "title": "CyberScientist Brain Decision",
  "description": "Validate structure, then validate authority, current state, references, action combinations and budgets in the controller.",
  "type": "object",
  "properties": {
    "schema_version": {
      "enum": [
        1,
        2
      ]
    },
    "decision_id": {
      "type": "string",
      "minLength": 1
    },
    "run_id": {
      "type": "string",
      "minLength": 1
    },
    "observed_state_version": {
      "type": "integer",
      "minimum": 0
    },
    "summary": {
      "type": "string",
      "minLength": 1
    },
    "evidence_refs": {
      "type": "array",
      "items": {
        "type": "string",
        "minLength": 1
      }
    },
    "actions": {
      "type": "array",
      "minItems": 1,
      "items": {
        "oneOf": [
          {
            "type": "object",
            "properties": {
              "op": {
                "const": "start_trial"
              },
              "goal": {
                "type": "string",
                "minLength": 1
              },
              "success_check": {
                "type": "string",
                "minLength": 1
              }
            },
            "required": [
              "op",
              "goal",
              "success_check"
            ],
            "additionalProperties": false
          },
          {
            "type": "object",
            "properties": {
              "op": {
                "const": "steer"
              },
              "trial_id": {
                "type": "string",
                "minLength": 1
              },
              "message": {
                "type": "string",
                "minLength": 1
              }
            },
            "required": [
              "op",
              "trial_id",
              "message"
            ],
            "additionalProperties": false
          },
          {
            "type": "object",
            "properties": {
              "op": {
                "const": "wait"
              },
              "reason": {
                "type": "string",
                "minLength": 1
              },
              "duration_seconds": {
                "type": "integer",
                "minimum": 1,
                "maximum": 86400
              }
            },
            "required": [
              "op",
              "reason"
            ],
            "additionalProperties": false
          },
          {
            "type": "object",
            "properties": {
              "op": {
                "const": "pause"
              },
              "reason": {
                "type": "string",
                "minLength": 1
              }
            },
            "required": [
              "op",
              "reason"
            ],
            "additionalProperties": false
          },
          {
            "type": "object",
            "properties": {
              "op": {
                "const": "refresh_platform"
              },
              "reason": {
                "type": "string",
                "minLength": 1
              }
            },
            "required": [
              "op",
              "reason"
            ],
            "additionalProperties": false
          },
          {
            "type": "object",
            "properties": {
              "op": {
                "const": "request_submission"
              },
              "trial_id": {
                "type": "string",
                "minLength": 1
              },
              "bundle_manifest_ref": {
                "type": "string",
                "minLength": 1
              }
            },
            "required": [
              "op",
              "trial_id",
              "bundle_manifest_ref"
            ],
            "additionalProperties": false
          },
          {
            "type": "object",
            "properties": {
              "op": {
                "const": "promote_experience"
              },
              "experience_id": {
                "type": "string",
                "minLength": 1
              },
              "revision_hash": {
                "type": "string",
                "minLength": 1
              },
              "reason": {
                "type": "string",
                "minLength": 1
              },
              "evidence_refs": {
                "type": "array",
                "minItems": 1,
                "items": {
                  "type": "string",
                  "minLength": 1
                }
              }
            },
            "required": [
              "op",
              "experience_id",
              "revision_hash",
              "reason",
              "evidence_refs"
            ],
            "additionalProperties": false
          },
          {
            "type": "object",
            "properties": {
              "op": {
                "const": "finish"
              },
              "reason": {
                "type": "string",
                "minLength": 1
              },
              "finish_confirmation": {
                "type": "object",
                "additionalProperties": false,
                "properties": {
                  "token": {
                    "type": "string",
                    "pattern": "^[a-f0-9]{64}$"
                  },
                  "reason_md": {
                    "type": "string",
                    "minLength": 1,
                    "maxLength": 2000
                  }
                },
                "required": [
                  "token",
                  "reason_md"
                ]
              },
              "objective_assessment": {
                "type": "object",
                "additionalProperties": false,
                "properties": {
                  "status": {
                    "enum": [
                      "achieved",
                      "partial",
                      "not_achievable",
                      "stopped"
                    ]
                  },
                  "evidence_refs": {
                    "type": "array",
                    "items": {
                      "type": "string"
                    }
                  },
                  "remaining_md": {
                    "type": "string"
                  }
                },
                "required": [
                  "status",
                  "evidence_refs",
                  "remaining_md"
                ]
              }
            },
            "required": [
              "op",
              "reason"
            ],
            "additionalProperties": false
          }
        ]
      }
    },
    "experience_proposals": {
      "type": "array",
      "items": {
        "type": "object",
        "properties": {
          "scope": {
            "enum": [
              "global",
              "challenge"
            ]
          },
          "challenge_id": {
            "type": [
              "string",
              "null"
            ],
            "minLength": 1
          },
          "title": {
            "type": "string",
            "minLength": 1
          },
          "body_md": {
            "type": "string",
            "minLength": 1
          },
          "applicability": {
            "type": "string",
            "minLength": 1
          },
          "evidence_refs": {
            "type": "array",
            "items": {
              "type": "string",
              "minLength": 1
            }
          },
          "target_id": {
            "type": "string",
            "minLength": 1,
            "description": "更新已有经验条目的 id；缺省=新建。冲突语义=追加新修订"
          },
          "kind": {
            "enum": [
              "heuristic",
              "procedure",
              "failure",
              "platform",
              "strategy"
            ]
          },
          "audience": {
            "enum": [
              "brain",
              "executor",
              "both"
            ],
            "description": "经验投递角色；缺省为 both，环境事实不可由代理提议"
          },
          "expected_revision": {
            "type": "string",
            "minLength": 1
          },
          "evidence_status": {
            "enum": [
              "hypothesis",
              "observed",
              "validated",
              "contradicted"
            ]
          },
          "tags": {
            "type": "array",
            "items": {
              "type": "string"
            }
          },
          "derived_from": {
            "type": "array",
            "items": {
              "type": "string"
            }
          },
          "expires_at": {
            "type": [
              "string",
              "null"
            ]
          }
        },
        "required": [
          "scope",
          "challenge_id",
          "title",
          "body_md",
          "applicability",
          "evidence_refs"
        ],
        "additionalProperties": false,
        "allOf": [
          {
            "if": {
              "properties": {
                "scope": {
                  "const": "global"
                }
              }
            },
            "then": {
              "properties": {
                "challenge_id": {
                  "type": "null"
                }
              }
            },
            "else": {
              "properties": {
                "challenge_id": {
                  "type": "string",
                  "minLength": 1
                }
              }
            }
          }
        ]
      }
    },
    "experience_uses": {
      "type": "array",
      "maxItems": 32,
      "items": {
        "type": "object",
        "additionalProperties": false,
        "properties": {
          "context_id": {
            "type": "string",
            "minLength": 1
          },
          "experience_id": {
            "type": "string",
            "minLength": 1
          },
          "revision_id": {
            "type": "string",
            "minLength": 1
          }
        },
        "required": [
          "context_id",
          "experience_id",
          "revision_id"
        ]
      }
    },
    "prediction_verdicts": {
      "type": "array",
      "maxItems": 20,
      "items": {
        "type": "object",
        "additionalProperties": false,
        "properties": {
          "submission_id": {
            "type": "string",
            "minLength": 1
          },
          "verdict": {
            "enum": [
              "confirmed",
              "refuted",
              "unclear"
            ]
          },
          "note_md": {
            "type": "string",
            "minLength": 1,
            "maxLength": 2000
          }
        },
        "required": [
          "submission_id",
          "verdict",
          "note_md"
        ]
      }
    },
    "pending_intent_resolution": {
      "enum": [
        "replay",
        "revise",
        "drop"
      ]
    },
    "research_brief": {
      "type": "object",
      "properties": {
        "problem_md": {
          "type": "string"
        },
        "science_md": {
          "type": "string"
        },
        "traps_md": {
          "type": "string"
        },
        "acceptance_md": {
          "type": "string"
        },
        "route_md": {
          "type": "string"
        },
        "difference_md": {
          "type": "string"
        },
        "ranked_methods": {
          "type": "array",
          "items": {
            "type": "object",
            "properties": {
              "name": {
                "type": "string"
              },
              "reason_md": {
                "type": "string"
              }
            },
            "required": [
              "name",
              "reason_md"
            ],
            "additionalProperties": false
          }
        },
        "parallel_preparation": {
          "type": "object",
          "properties": {
            "contract": {
              "type": "string"
            },
            "verifier": {
              "type": "string"
            },
            "environment": {
              "type": "string"
            }
          },
          "additionalProperties": false
        },
        "work_package": {
          "type": "object",
          "properties": {
            "algorithm_md": {
              "type": "string"
            },
            "formula_md": {
              "type": "string"
            },
            "parameter_ranges_md": {
              "type": "string"
            },
            "expected_intermediate_md": {
              "type": "string"
            },
            "test_cases_md": {
              "type": "string"
            },
            "stop_conditions_md": {
              "type": "string"
            }
          },
          "additionalProperties": false
        },
        "advice_md": {
          "type": "string"
        },
        "failed_routes": {
          "type": "array",
          "items": {
            "type": "object",
            "properties": {
              "route_md": {
                "type": "string"
              },
              "evidence_refs": {
                "type": "array",
                "items": {
                  "type": "string"
                }
              }
            },
            "required": [
              "route_md",
              "evidence_refs"
            ],
            "additionalProperties": false
          }
        },
        "environment_choice": {
          "type": "object",
          "properties": {
            "mode": {
              "enum": [
                "catalog",
                "from_zero"
              ]
            },
            "entry_id": {
              "type": [
                "string",
                "null"
              ]
            },
            "reason_md": {
              "type": "string",
              "minLength": 1,
              "maxLength": 2000
            }
          },
          "required": [
            "mode",
            "reason_md"
          ],
          "additionalProperties": false,
          "allOf": [
            {
              "if": {
                "properties": {
                  "mode": {
                    "const": "catalog"
                  }
                }
              },
              "then": {
                "required": [
                  "entry_id"
                ],
                "properties": {
                  "entry_id": {
                    "type": "string",
                    "minLength": 1
                  }
                }
              },
              "else": {
                "properties": {
                  "entry_id": {
                    "type": "null"
                  }
                }
              }
            }
          ]
        },
        "method_proposal": {
          "type": "object",
          "properties": {
            "method_md": {
              "type": "string",
              "minLength": 1,
              "maxLength": 20000
            },
            "parameters_md": {
              "type": "string",
              "minLength": 1,
              "maxLength": 20000
            },
            "basis_md": {
              "type": "string",
              "minLength": 1,
              "maxLength": 20000
            },
            "outputs_md": {
              "type": "string",
              "minLength": 1,
              "maxLength": 20000
            },
            "capabilities": {
              "type": "array",
              "minItems": 1,
              "maxItems": 30,
              "items": {
                "type": "string",
                "minLength": 1,
                "maxLength": 300
              }
            }
          },
          "required": [
            "method_md",
            "parameters_md",
            "basis_md",
            "outputs_md",
            "capabilities"
          ],
          "additionalProperties": false
        },
        "major_change": {
          "type": "boolean"
        },
        "major_change_reason_md": {
          "type": "string"
        }
      },
      "additionalProperties": false
    }
  },
  "required": [
    "schema_version",
    "decision_id",
    "run_id",
    "observed_state_version",
    "summary",
    "evidence_refs",
    "actions",
    "experience_proposals"
  ],
  "additionalProperties": false
}
